S.No.,Company,Job ID,Function,Location,Title,Description,Posted On,Page Number
97,Deloitte,68504,,Mumbai,Enabling Area - AI Architect - Information Technology,"Your potential, unleashed.

 

India’s impact on the global economy has increased at an exponential rate and Deloitte presents an opportunity to unleash and realise your potential amongst cutting edge leaders, and organisations shaping the future of the region, and indeed, the world beyond.

 

At Deloitte, your whole self to work, every day. Combine that with our drive to propel with purpose and you have the perfect playground to collaborate, innovate, grow, and make an impact that matters.

 



JOB SUMMARY:                       

1.Architecture Design: Design end-to-end architecture for AI solutions, including data ingestion, processing, modeling, deployment, and monitoring. Define architecture patterns, components, and interfaces to ensure scalability, performance, and reliability.

2.Innovation - Identify opportunities for leveraging AI to drive innovation, improve processes, and create value for internal stakeholders.

2. Technology Evaluation: Evaluate and select appropriate AI technologies, frameworks, and tools to support the implementation of AI solutions. Stay abreast of emerging AI trends and advancements to inform technology decisions and architectural design.

3.Model Development and Optimization: Collaborate with data scientists and machine learning engineers to develop and optimize machine learning and deep learning models. Ensure best practices in model development, training, evaluation, and deployment.

4.Integration and Deployment: Integrate AI solutions into existing systems and infrastructure. Define deployment strategies and processes for deploying AI models in production environments, including cloud-based and edge computing platforms.

5.Performance Monitoring and Optimization: Establish monitoring and optimization mechanisms to track the performance, accuracy, and efficiency of AI systems in production. Implement feedback loops and continuous improvement processes to optimize AI models and algorithms over time.

6.Governance and Compliance: Define governance policies and practices for AI development, deployment, and usage. Ensure compliance with regulatory requirements, ethical standards, and privacy considerations in AI initiatives.

7.Collaboration and Leadership: Collaborate with cross-functional teams, including data scientists, engineers, product managers, and business stakeholders, to drive AI projects from concept to delivery. Provide technical leadership and mentorship to team members.

 

Qualifications:

•Bachelor's, Master's, or Ph.D. degree in Computer Science, Artificial Intelligence, or a related field.

•Minimum of 7+ years of relevant professional experience as an AI Architect or similar role, with a focus on designing and implementing AI solutions.

•Deep understanding of machine learning, deep learning, and other AI techniques and algorithms.

•Experience with AI development frameworks and libraries such as TensorFlow, PyTorch, scikit-learn, or Apache MXNet.

•Proficiency in programming languages such as Python, Java, or Scala.

•Strong knowledge of cloud platforms such as AWS, Azure, or Google Cloud Platform.

•Experience with containerization and orchestration technologies such as Docker and Kubernetes.

•Excellent problem-solving skills and analytical thinking.

•Strong communication and collaboration skills, with the ability to work effectively in cross-functional teams.

•Leadership experience, with the ability to inspire and influence team members and stakeholders.

 

Preferred Qualifications:

•Experience with AI applications in specific domains such as computer vision, natural language processing, or reinforcement learning.

•Knowledge of edge computing and IoT (Internet of Things) technologies.

•Understanding of DevOps principles and practices for AI development and deployment.

 

Your role as a

 

We expect our people to embrace and live our purpose by challenging themselves to identify issues that are most important for our clients, our people, and for society.

 

In addition to living our purpose, Senior Executive across our organization must strive to be:

 

Inspiring - Leading with integrity to build inclusion and motivation
Committed to creating purpose - Creating a sense of vision and purpose
Agile - Achieving high-quality results through collaboration and Team unity
Skilled at building diverse capability - Developing diverse capabilities for the future
Persuasive / Influencing - Persuading and influencing stakeholders
Collaborating - Partnering to build new solutions
Delivering value - Showing commercial acumen
Committed to expanding business - Leveraging new business opportunities
Analytical Acumen - Leveraging data to recommend impactful approach and solutions through the power of analysis and visualization
Effective communication – Must be well abled to have well-structured and well-articulated conversations to achieve win-win possibilities
Engagement Management / Delivery Excellence - Effectively managing engagement(s) to ensure timely and proactive execution as well as course correction for

the success of engagement(s)

Managing change - Responding to changing environment with resilience
Managing Quality & Risk - Delivering high quality results and mitigating risks with utmost integrity and precision
Strategic Thinking & Problem Solving - Applying strategic mindset to solve business issues and complex problems
Tech Savvy - Leveraging ethical technology practices to deliver high impact for clients and for Deloitte
Empathetic leadership and inclusivity - creating a safe and thriving environment where everyone's valued for who they are, use empathy to understand others to adapt our behaviours and attitudes to become more inclusive. 

 

 We recognise there is no one size fits all career path, and global, cross-business mobility and up / re-skilling are all within the range of possibilities to shape a unique and fulfilling career. Know more about Life at Deloitte.

 

 

Everyone’s welcome… entrust your happiness to us                                                                                                                 

 

Our workspaces and initiatives are geared towards your 360-degree happiness. This includes specific needs you may have in terms of accessibility, flexibility, safety and security, and caregiving. Here’s a glimpse of things that are in store for you. 

 

 

Interview tips

 

We want job seekers exploring opportunities at Deloitte to feel prepared, confident and comfortable. To help you with your interview, we suggest that you do your research, know some background about the organisation and the business area you’re applying to. Check out recruiting tips from Deloitte professionals.

 

Conclusion

*Caution against fraudulent job offers*: We would like to advise career aspirants to exercise caution against fraudulent job offers or unscrupulous practices.

At Deloitte, ethics and integrity are fundamental and not negotiable.  We do not charge any fee or seek any deposits, advance, or money from any career aspirant in relation to our recruitment process.  We have not authorized any party or person to collect any money from career aspirants in any form whatsoever for promises of getting jobs in Deloitte or for being considered against roles in Deloitte. We follow a professional recruitment process, provide a fair opportunity to eligible applicants and consider candidates only on merit. No one other than an authorized official of Deloitte is permitted to offer or confirm any job offer from Deloitte.  We advise career aspirants to exercise caution.

In this regard, you may refer to a more detailed advisory given on our website at: https://www2.deloitte.com/in/en/careers/advisory-for-career-aspirants.html?icid=wn_","Oct 28, 2024",3
99,Deloitte,69071,,Pune,Enabling Areas- Operate SGO- Enterprise/Solution Architect,"Role: Enterprise Architect

 

Your potential, unleashed.

 

India’s impact on the global economy has increased at an exponential rate and Deloitte presents an opportunity to unleash and realise your potential amongst cutting edge leaders, and organisations shaping the future of the region, and indeed, the world beyond.

 

At Deloitte, your whole self to work, every day. Combine that with our drive to propel with purpose and you have the perfect playground to collaborate, innovate, grow, and make an impact that matters.

 

 

The team
 

The Deloitte South Asia strategic growth team serves as a central pillar driving growth and transformation within DSA, spanning several business lines and various technology functions.  We are established as a centralized team collaborating across consulting, implementation, and operation to maintain and enhance client value offerings and services. We innovate conventional approaches, leveraging Deloitte technology, differentiated domain expertise, intellectual property, talent, and capacity to embed continuous advantage and deliver enhanced business value.

In this team, our focus is on catering to the unique needs and preferences of clients in the South Asia region. Your role within this dynamic team is essential for establishing networks and relationships across the client stakeholder ecosystem and ensuring service fulfillment. Additionally, you will collaborate closely with other Deloitte leadership and stakeholders dedicated to the client. Your contributions will involve nurturing new and existing relationships, supporting presales life cycles, and playing a pivotal role in driving the success of DSA business growth for the specific client.

You will be part of a global organization that is making a measurable impact that matters every day.

 


 

Your work profile

 

As an Enterprise Architect, you will be at the forefront of business development, technical advisory, shaping and presenting solutions and services to the client stakeholders. As an Enterprise Architect, you will be responsible for working with client, partners and prospects, to gather their IT and business insights and translate them into an enterprise technology solution using various SaaS, PaaS, ERP’s, digital and cloud Platforms and communicate the value of our solutions/services to business and technical prospective users and decision makers.

This is a great opportunity to join our expanding growth team, leveraging Deloitte’s network and capabilities to grow and build a world-class offerings, technology-solutions and services to our estimated clients.

You possess experience collaborating with and effectively engaging with client executives, senior leaders, partners, and teams to foster business development, value creation, and the overall growth of the business.

 

Your responsibilities will include:

 

Responsibilities:

 

Presales:

The Single point of contact and leader responsible for strategizing and promoting Deloitte offerings across IT, SaaS, PaaS, Digital, and Cloud ecosystems, in partnership with the Customer Success Account Manager, for the client's cross-selling and upselling initiatives.

Lead development of multi-year business and technology growth strategies and roadmaps for Deloitte across domains and technologies functions; help facilitating opportunity identification, business cases, technology adoption, operating model, and innovation opportunities etc.

Preparing technical & commercial presentations, proposals based on request for information (RFI) & request for proposal (RFP).

Collaborate with cross functional, technical and sales teams to develop presales strategies for enterprise digital and cloud solutions spanning Deloitte's business and technology domains.

Craft innovative and tailored solutions that address client challenges and goals.

 

Solution and Architecture:

Architect end-to-end business and technology solutions during the presales process, ensuring alignment with client requirements, business goals and outcomes.

Learn and Analyze architecture pain points to determine the best and cost-effective technical solutions and gain experience with tools, technologies, and platforms across many technology stacks.

Experience with SaaS, PaaS, Digital and cloud Transformation/Optimization or Cloud Migration (Lift-Shift), App Modernization projects with Enterprise customers in a multi-region, multi-availability environments.

Provide architecture leadership and oversight for transformational enterprise impacting initiatives. 

Lead and build development and maintenance of architecture artifacts, frameworks, reusable assets and patterns as references for engineers and architects. 

 

Client Engagement:

Engage directly with clients to understand their strategic and operational needs and present our offerings and solutions effectively.

Conduct workshops and presentations to showcase the value proposition of our offerings.

 

Value Proposition Development:

Partner with stakeholders early in the project lifecycle to identify business, information, technical and security issues and act as a strategic consultant throughout the technology lifecycle. 

Participate in the Central of excellence activities, architecture community of practice, internal knowledge sharing sessions, external events.

Define and articulate the unique value propositions, accelerators, templates, and reusable assets of our practices and domains.

Collaborate with technical teams to develop prototypes and proof of concepts.

Work closely with marketing teams to develop collateral that supports presales activities.

 

Collaboration:

with external and cross-functional teams, including Centers of Excellence (CoEs), technology, delivery, and operations teams, to ensure the seamless integration of Deloitte solutions and offerings.

Provide technical insights to enhance the overall effectiveness of Deloitte offerings.

 

Desired qualifications

Educational Background:
Engineering “STEM” (Science / Technology / Engineering / Math) major from a premier institute
Enterprise Architect certification (TOGAF 9.0 / etc.)
MBA from a top-tier business school preferred
Experience:
10+ yrs. of proven experience in enterprise architect, presales roles, specifically in the consulting and presentation of business and technology solutions for client/industry.
Life Science/ Consumer/ Energy industry expertise is a must.
Solid understanding of market and industry trends, operational challenges and industry best practices.
Software development background will be an advantage.
Technical Skills:
Proficiency in SaaS, PaaS, Digital and cloud Transformation, Optimization technologies, cloud platforms and a strong grasp of presales methodologies.
Communication Skills:
Effective communication is essential for understanding client requirements and building rapport with stakeholders, especially in executive leadership roles.
Excellent communication and presentation skills, with the ability to convey complex technical concepts to both technical and non-technical stakeholders.

 

Innovation and Adaptability:
Demonstrated ability to craft innovative solutions and adapt to evolving client needs.
Proven ability to work in a fast-paced, dynamic environment.
Motivated, energetic, and self‐directed. 
Capable of building effective working relationships with internal stakeholders across multiple business areas, functions, and geographies.
Flexibility and adaptability to different cultures, time zones, and work practices, adjusting communication and approach accordingly.

 

Location and way of working

Base location: Pune/ Bangalore
This profile involves frequent travelling to client locations
Hybrid is our default way of working. Each domain has customised the hybrid approach to their unique needs.

 

Your role as a leader

 

We expect our people to embrace and live our purpose by challenging themselves to identify issues that are most important for our clients, our people, and for society.

 

In addition to living our purpose, leaders across our organization must strive to be:

 

Inspiring - Leading with integrity to build inclusion and motivation
Committed to creating purpose - Creating a sense of vision and purpose
Agile - Achieving high-quality results through collaboration and Team unity
Skilled at building diverse capability - Developing diverse capabilities for the future
Persuasive / Influencing - Persuading and influencing stakeholders
Collaborating - Partnering to build new solutions
Delivering value - Showing commercial acumen
Committed to expanding business - Leveraging new business opportunities
Analytical Acumen - Leveraging data to recommend impactful approach and solutions through the power of analysis and visualization
Effective communication – Must be well abled to have well-structured and well-articulated conversations to achieve win-win possibilities
Engagement Management / Delivery Excellence - Effectively managing engagement(s) to ensure timely and proactive execution as well as course correction for

the success of engagement(s)

Managing change - Responding to changing environment with resilience
Managing Quality & Risk - Delivering high quality results and mitigating risks with utmost integrity and precision
Strategic Thinking & Problem Solving - Applying strategic mindset to solve business issues and complex problems
Tech Savvy - Leveraging ethical technology practices to deliver high impact for clients and for Deloitte
Empathetic leadership and inclusivity - creating a safe and thriving environment where everyone's valued for who they are, use empathy to understand others to adapt our behaviours and attitudes to become more inclusive. 

 

 We recognise there is no one size fits all career path, and global, cross-business mobility and up / re-skilling are all within the range of possibilities to shape a unique and fulfilling career. Know more about Life at Deloitte.

 

 

Everyone’s welcome… entrust your happiness to us                                                                                                                 

                                                                                                                

Our workspaces and initiatives are geared towards your 360-degree happiness. This includes specific needs you may have in terms of accessibility, flexibility, safety and security, and caregiving. Here’s a glimpse of things that are in store for you.  

 

 

Interview tips

 

We want job seekers exploring opportunities at Deloitte to feel prepared, confident and comfortable. To help you with your interview, we suggest that you do your research, know some background about the organisation and the business area you’re applying to. Check out recruiting tips from Deloitte professionals.","Oct 28, 2024",3
76,Deloitte,69691,,Bengaluru,T&T - Customer - HCL Commerce - Analyst/Consultant/Senior Consultant,"T&T - Customer - HCL Commerce

Your potential, unleashed.

 

India’s impact on the global economy has increased at an exponential rate and Deloitte presents an opportunity to unleash and realise your potential amongst cutting edge leaders, and organisations shaping the future of the region, and indeed, the world beyond.

 

At Deloitte, your whole self to work, every day. Combine that with our drive to propel with purpose and you have the perfect playground to collaborate, innovate, grow, and make an impact that matters.



 

The Team
 

Deloitte Digital has created a new model for a new age: the creative digital consultancy. We're transforming the digital journey in a way an agency or traditional consultancy alone cannot–now leaders across their entire organization can come to one place to have their ambitions brought to life. We combined the creative and digital capabilities of our studios and the broad reach of an advertising agency with the technical experience, deep business strategy, and relationships of one of the world's largest consultancy to create something that is so much more than the sum of its parts. We can help you imagine bigger and scale as your business grows. Learn more about Digital
 

Location and way of working-Bangalore

 

Work you’ll do

Qualifications:

3 to 8 years of total IT experience.
2 to 8 years of HCL Commerce experience.
Proficient in HCL Commerce v9+ and RESTful API development.
Strong understanding of CI/CD, Spring Boot, and containerization.
Experience with Solr customization, Java, J2EE, Oracle DB/DB2, and Linux/Shell scripting.
Familiar with design patterns and best practices.
Knowledge of HCL Commerce architecture and subsystems.
Experience in microservices (optional) and agile methodologies.


Responsibilities:

Develop/customize solutions in HCL Commerce v9+.
Implement/manage RESTful APIs with Commerce REST framework.
Utilize CI/CD tools and understand containerization in HCL Commerce v9.
Develop with Spring Boot.
Customize management center (optional).
Enhance member, payment, and order subsystems.
Customize Solr profiles.
Apply design patterns, cutover strategies, and performance improvements.
Work with HCL Commerce data models, Java, J2EE, Oracle DB/DB2, Linux/Shell scripting.
Perform SOLR/Elastic Search customization.
Integrate and design custom solutions within HCL Commerce.
Utilize HCL Commerce Server subsystems (Catalog, Order, Member, Payment).
Work on B2B, B2C, and extended site models.
Develop microservices (optional).
Implement TDD, integration testing, and end-to-end testing.
Follow agile methodology and participate in scrum ceremonies.
Manage code with Git/Bitbucket.

Preferred:

Management center customization experience.
Performance improvement and production cutover strategy knowledge.","Oct 28, 2024",4
