S.No.,Company,Job ID,Function,Location,Title,Description,Posted On,Page Number
70,Deloitte,70975,,Mumbai,S&T- Corporate Finance Advisory ICC- Deal Origination- Deputy Manager,"Your potential, unleashed.

 

India’s impact on the global economy has increased at an exponential rate and Deloitte presents an opportunity to unleash and realise your potential amongst cutting edge leaders, and organisations shaping the future of the region, and indeed, the world beyond.

 

At Deloitte, your whole self to work, every day. Combine that with our drive to propel with purpose and you have the perfect playground to collaborate, innovate, grow, and make an impact that matters.

 

The team
 

ICC CFA team provides advisory & research support services to Deloitte members firms across diverse nature of the business development and M&A engagements. We work as an extension of our Deloitte member firms’ CFA practices and provide dedicated client support throughout the M&A lifecycle. Working on international assignments involving cross-border and cross-service line teams allows you to build your networks across the vast Global Deloitte network and develop understanding of the global CFA standards.

 

Our core service offerings include working on pitch documents and deal documents such as IM, teasers and management presentation. We also provide support on company analysis, industry research, identifying potential buyer/targets, company profiles, relative valuation, client talking points, newsletter/dashboards, etc.
 

Your work profile

 

As a Assistant Manager / Deputy Manager in our Corporate Finance Advisory team you’ll be working with our Swiss Corporate Finance team on their pitch/proposals and mandates. You’ll be required nurture positive working relationships with teams and clients with the intention to exceed client expectations: -

 

A career within CFA practice will provide a wide & valuable experience in an exciting and dynamic working & learning environment. The role will position you to support on all aspects of an M&A engagement which include the following activities:

Support Deloitte member firms’ CFA practice
Prepare transaction specific and marketing materials (teasers, information memorandum, pitch books, corporate profiles, and industry data and analyses)
Develop, review and interpret the valuation analysis (DCF, LBO, PPA) discussing key valuation drivers with project leaders and onshore clients
Identify potential financial and strategic buyers; perform in-depth company and industry research supporting specific client engagements and marketing opportunities
Serve as a critical project member for the execution and management of advisory projects; take ownership of projects by delivering quality output on a timely basis; ensure all end deliverables are thoroughly reviewed and are of highest quality;
Work towards tight deadlines, adding value to complex and high profile projects
Provide guidance, training and timely feedback to project team
Demonstrate strong business diagnostic skills and the ability to apply a logical and analytical approach to problem solving

 

 

Desired qualifications

Strong academic qualification (CA, CFA, CPA, Masters in Finance/Management/Economics); MBA from an accredited college/university preferred
Prior transaction related experience (3+ years) in a corporate finance environment from a captive wall street, boutique or middle-market investment bank with a track record of academic and professional success
Valuation experience gained either in a Big 4 / valuation firm, bank, private equity or similar institution with typically relevant finance/valuation related professional experience

 

In order to be considered for this role, your competencies will cover the broad scope of CFA services, leveraging your professional background and skills such as:

Excellent track record and strong academic achievements
Excellent verbal and written communication skills
Strong understanding of valuation methodologies
Proven analytical and systematic problem solving skills
Ability to quickly interpret and review financial statements and apply basic financial, accounting and valuation skills
Working knowledge of data sources such as Capital IQ, Bloomberg, Mergermarket, Thomson etc. would be an asset 
Basic to advance knowledge of MS Office
Interest in working in a challenging and dynamic environment
Ability to work independently with minimal supervision and with staff at all levels of the organization
Proactive and an inquisitive mind, with a passion to provide world class client service

 

Location and way of working

Base location: Mumbai / NCR
Hybrid is our default way of working. Each domain has customised the hybrid approach to their unique needs.

 

Your role as a Assistant Manager / Deputy Manager

 

We expect our people to embrace and live our purpose by challenging themselves to identify issues that are most important for our clients, our people, and for society.

 

In addition to living our purpose, Assistant Manager / Deputy Manager across our organization must strive to be:

 

Inspiring - Leading with integrity to build inclusion and motivation
Committed to creating purpose - Creating a sense of vision and purpose
Agile - Achieving high-quality results through collaboration and Team unity
Skilled at building diverse capability - Developing diverse capabilities for the future
Persuasive / Influencing - Persuading and influencing stakeholders
Collaborating - Partnering to build new solutions
Delivering value - Showing commercial acumen
Committed to expanding business - Leveraging new business opportunities
Analytical Acumen - Leveraging data to recommend impactful approach and solutions through the power of analysis and visualization
Effective communication – Must be well abled to have well-structured and well-articulated conversations to achieve win-win possibilities
Engagement Management / Delivery Excellence - Effectively managing engagement(s) to ensure timely and proactive execution as well as course correction for

the success of engagement(s)

Strategic Thinking & Problem Solving - Applying strategic mindset to solve business issues and complex problems

 

 We recognise there is no one size fits all career path, and global, cross-business mobility and up / re-skilling are all within the range of possibilities to shape a unique and fulfilling career. Know more about Life at Deloitte.

 

 

Everyone’s welcome… entrust your happiness to us                                                                                                                 

                                                                                                                

Our workspaces and initiatives are geared towards your 360-degree happiness. This includes specific needs you may have in terms of accessibility, flexibility, safety and security, and caregiving. Here’s a glimpse of things that are in store for you.  

 

 

Interview tips

 

 

We want job seekers exploring opportunities at Deloitte to feel prepared, confident and comfortable. To help you with your interview, we suggest that you do your research, know some background about the organisation and the business area you’re applying to. Check out recruiting tips from Deloitte professionals.","Oct 29, 2024",2
72,Deloitte,71776,,Delhi,T&T- Customer - M&C - SFMC - M,"SALESFORCE MARKETING CLOUD LEAD


As a Salesforce Marketing Cloud (SFMC) LEAD, you will bring considerable technical and product expertise to deliver world-class SFMC-based solutions to clients. You will be part of a dynamic leadership team that will be responsible for driving SFMC technical solutions at client sites. The projects that you will lead would allow you the opportunity to work with some of the most in-demand and newest features of SFMC such as Data Cloud, Interaction Studio, Datorama, Audience Studio, etc.

           

Work You’ll Do

 

Understanding client business and technical requirements
Work alongside the wider team, lead the overall technology solution, planning and estimation for complex projects
Managing internal, client and partner stakeholders, including C-level executives
Mobilizing and managing engagement teams, and establishing the project structure and governance
Managing engagement economics, risk and day-to-day interactions with executive clients and sponsors
Defining requirements and driving the completion of deliverables
Manage the delivery teams to deliver full lifecycle implementations, with a focus on the client's success but awareness of other wider business and technology-focused delivery considerations
Conduct quality reviews of our implementation to ensure they meet our high standards
Act as a role model for the team by always demonstrating the highest standards in business, digital-led transformation
Drive innovation and continuous improvement in the design and delivery practices of our solutions, including Salesforce Marketing Cloud’s best practice in the implementation of client solutions.
Leading business development initiatives including selling to C-level executives and
Develop and maintain certifications and trainings with salesforce as new technologies and upgrades are released
Lead end-to-end pre-sales activities.
Provide leadership and support for delivery teams and staff in local offices.

 

 

PREFERRED

 

Salesforce or SFMC certifications preferred
Understanding or exposure to SFMC components (i.e. Audience Studio, Datorama, Interaction Studio, etc.)
Experience with other marketing technologies and analytics tools (i.e. Adobe, Oracle, Sprinklr, Google, etc.)
Knowledge of Salesforce Sales Cloud, preferred but not required
Knowledge of Salesforce Data Cloud
Experience in leading SFMC implementations
Experience leading large teams (on- and off-shore) and technology engagements, including client and consulting staff
Strong communication skills (interactions with executive clients and sponsors)
Experience with selling to C-level executives and other business development activities

 

QUALIFICATION

 

Four-Year Bachelor’s Degree
9+ years of relevant technology consulting or industry experience
Hands-on platform experience on Salesforce Marketing Cloud, and/or other SFMC ecosystem platforms (i.e. Audience Studio-DMP, Datorama, Interaction Studio, etc.)
Experience leading large full-lifecycle implementations and/or implementing integrated solutions including other SFMC ecosystem technologies, cloud-based marketing solutions, integration services and data modelling
Great communicator, capable of articulating and collaborating confidently with various departments
Experience in Agile/ Scrum will be a bonus point.

 

 

 

 

The Team

The Digital Customer & Marketing in Deloitte focuses on owning the commercial agenda through growth strategy, enhanced user experiences, and engagement through the entire customer lifecycle. From our core strengths in creative design, to strategy, platforms and solutions, as well as our continued growth through acquisitions, we are specifically positioned to bring fully integrated solutions to our clients.

We are all consumers and personal marketers. This reality is what makes the Customer & Marketing Offering Portfolio so exciting. What we deliver in the market each and every day directly impacts who we are as customers. We are able to deliver on outcomes for the very products and services that we have the privilege of engaging with ourselves.

Our Advertising, Marketing & Commerce team focuses on delivering marketing and growth objectives aligned with our clients’ brand values for measurable business growth. We do this by creating content, communications, and experiences that engage and inspire their customers to act. We implement and operate the technology platforms that enable personalized content, commerce and marketing user-centric experiences. In doing so, we transform our clients’ marketing and engagement operations into modern, data-driven, creatively focused organizations. Our team brings deep experience in creative and digital marketing capabilities, many from our Digital Studios.
 

We serve our clients through the following types of work:

Cross-channel customer engagement strategy, design and development (web, mobile, social, physical)
eCommerce strategy, implementation and operations
Marketing Content and digital asset management solutions
Marketing Technology and Advertising Technology solutions
Marketing analytics implementation and operations
Advertising campaign ideation, development and execution
Acquisition and engagement campaign ideation, development and execution
Agile based, design-thinking, user-centric, empirical projects that accelerate results","Oct 29, 2024",2
74,Deloitte,69898,,Bengaluru,T&T - Customer - HCL Commerce - Consultant,"T&T - Customer - HCL Commerce

Your potential, unleashed.

 

India’s impact on the global economy has increased at an exponential rate and Deloitte presents an opportunity to unleash and realise your potential amongst cutting edge leaders, and organisations shaping the future of the region, and indeed, the world beyond.

 

At Deloitte, your whole self to work, every day. Combine that with our drive to propel with purpose and you have the perfect playground to collaborate, innovate, grow, and make an impact that matters.



 

The Team
 

Deloitte Digital has created a new model for a new age: the creative digital consultancy. We're transforming the digital journey in a way an agency or traditional consultancy alone cannot–now leaders across their entire organization can come to one place to have their ambitions brought to life. We combined the creative and digital capabilities of our studios and the broad reach of an advertising agency with the technical experience, deep business strategy, and relationships of one of the world's largest consultancy to create something that is so much more than the sum of its parts. We can help you imagine bigger and scale as your business grows. Learn more about Digital
 

Location and way of working-Bangalore

 

Work you’ll do

Qualifications:

3 to 8 years of total IT experience.
2 to 8 years of HCL Commerce experience.
Proficient in HCL Commerce v9+ and RESTful API development.
Strong understanding of CI/CD, Spring Boot, and containerization.
Experience with Solr customization, Java, J2EE, Oracle DB/DB2, and Linux/Shell scripting.
Familiar with design patterns and best practices.
Knowledge of HCL Commerce architecture and subsystems.
Experience in microservices (optional) and agile methodologies.


Responsibilities:

Develop/customize solutions in HCL Commerce v9+.
Implement/manage RESTful APIs with Commerce REST framework.
Utilize CI/CD tools and understand containerization in HCL Commerce v9.
Develop with Spring Boot.
Customize management center (optional).
Enhance member, payment, and order subsystems.
Customize Solr profiles.
Apply design patterns, cutover strategies, and performance improvements.
Work with HCL Commerce data models, Java, J2EE, Oracle DB/DB2, Linux/Shell scripting.
Perform SOLR/Elastic Search customization.
Integrate and design custom solutions within HCL Commerce.
Utilize HCL Commerce Server subsystems (Catalog, Order, Member, Payment).
Work on B2B, B2C, and extended site models.
Develop microservices (optional).
Implement TDD, integration testing, and end-to-end testing.
Follow agile methodology and participate in scrum ceremonies.
Manage code with Git/Bitbucket.

Preferred:

Management center customization experience.
Performance improvement and production cutover strategy knowledge.","Oct 29, 2024",2
51,Deloitte,71394,,Mumbai,Consulting- ET&P- SAP Project Manager- Manager,"Implementation of SAP S/4 HANA as Project Manager / Program Manager
Working in Domestic client
India localization – GST
No Travel Constraint
Worked on Pre-sales / Pursuit
Client Management","Oct 29, 2024",3
53,Deloitte,70712,,Bengaluru,A&A - Statutory Audit - SM,"Audit & Assurance/Statutory Audit
Statutory Audit 
Your potential, unleashed.
India’s impact on the global economy has increased at an exponential rate and Deloitte presents an opportunity to unleash and realize your potential amongst cutting edge leaders, and organizations shaping the future of the region, and indeed, the world beyond.
At Deloitte, your whole self to work, every day. Combine that with our drive to propel with purpose and you have the perfect playground to collaborate, innovate, grow, and make an impact that matters.
The team
Assurance is about much more than just the numbers. It’s about attesting to accomplishments and challenges and helping to assure strong foundations for future aspirations. Deloitte exemplifies the what, how, and why of change so you’re always ready to act ahead. Learn more about Audit & Assurance Practice
Your work profile
As a Director in our Statutory Audit (A&A) Team you’ll build and nurture positive working relationships with teams and clients with the intention to exceed client expectations: -
• You are expected to lead the field team in performing the statutory audit and report to the concerned Partner. The clientele would be across a gamut of industries.
• You will be responsible to direct and control the client’s overall audit, managing client relationships Ensuring timeliness efficiency and effectiveness, proactive identification of challenges and opportunities.
• You must exercise oversight of the firm's practice protection procedures, as they apply to their engagements, including the take-on process, updating of RED/ARM, quality control reviews.
• You should ensure that every aspect of the audit is complied with the firm’s standards.
• You must demonstrate Professional excellence and Optimizing Audit Execution.
• You are required to consult engagement decisions as appropriate with engagement Partner / Executive Director, EQCR, NPPD/ PPD and document the issue and resolutions thereof.
• You are expected to build eminence in marketplace, by participating in the professional external forums and events.
• You will be responsible for approving final billing for review by the Partner.
Desired qualifications
• They should be qualified Chartered Accountant.
• They must have 10 – 14 years of post-qualification statutory audit experience.
• They should be excellent in written and oral communication skills.
• They must demonstrate ability in delivering to agreed engagement plan.
• They require to have experience in client relationship development.
• They should be proficient with Microsoft Office applications.
• They require to have advance knowledge of Indian accounting standards both current and proposed.
• They require to have advance Knowledge of India auditing standards.","Oct 29, 2024",3
55,Deloitte,68094,,Delhi,Consulting - BO -CE Cloud Consultant- SME-PMO,"The team
 

Our Cloud Engineering team focuses on enabling our client’s end-to-end journey from On-Premise to Cloud, with opportunities in the areas of: Cloud Strategy, Op Model Transformation, Cloud Development, Cloud Integration & APIs, Cloud Migration, Cloud Infrastructure & Engineering, and Cloud Managed Services. We help our clients see the transformational capabilities of Cloud as an opportunity for business enablement and competitive advantage.

 

Cloud Engineering supports our clients as they improve agility and resilience, and identifies opportunities to reduce IT operations spend through automation by enabling Cloud. We accelerate our clients towards a technology-driven future, leveraging vendor solutions and Deloitte-developed software products, tools, and accelerators.


Job Description and Key Skills

Safeguards information system assets by identifying and solving potential and actual security problems.
Bid Process Management in Public Sector for IT solutions and components
Protects system by defining access privileges, control structures, and resources.
Recognizes problems by identifying abnormalities, reporting violations.
Implements security improvements by assessing current situation; evaluating trends; anticipating requirements.
Determines security violations and inefficiencies by conducting periodic audits.
Upgrades system by implementing and maintaining security controls.
Keeps users informed by preparing performance reports, communicating system status.
Maintains quality service by following organization standards.
Maintains technical knowledge by attending educational workshops, reviewing publications.
Contributes to team effort by accomplishing related results as needed.
Bachelor’s degree in computer science, Information Systems, or equivalent education or work experience
10 years of total work experience with 4+ relevant experience in Privaue cloud and infrastructure security and networking.
Advanced understanding of TCP/IP, common networking ports and protocols, traffic flow, system administration, OSI model, defense-in-depth and common security elements.
Hands-on experience analyzing high volumes of logs, network data (e.g. NetFlow, FPC), and other attack artifacts in support of incident investigations.
Experience with vulnerability scanning solutions.
Familiarity with the Information Assurance Vulnerability Management program.
Understating of design and architecture of Data Center components and Proficiency with solution like Anti-Virus, Antimalware, NMS, OS, Routing, Security and deployment rules,Sandboxing etc.
Experience developing and deploying signatures

 

Private cloud key Skills

System administration
Network Design and solution
Problem solving
Information rules and policies
On-call network troubleshooting
Server/Appliance management and administration
Network protocols
Routers, hubs, and switches
Informing others
Process improvement

 

Your role as a leader

 

At Deloitte India, we believe in the importance of leadership at all levels. We expect our people to embrace and live our purpose by challenging themselves to identify issues that are most important for our clients, our people, and for society, and make an impact that matters.

 

In addition to living our purpose, managers across our organization:

 

Develop self by actively seeking opportunities for growth, share knowledge and experiences with others, and act as a strong brand ambassadors
Understand objectives for clients and Deloitte, align own work to objectives and set personal priorities
Seek opportunities to challenge self
Collaborate with others across businesses and borders to deliver and take accountability for own and team results
Identify and embrace our purpose and values and put these into practice in their professional life
Build relationships and communicate effectively in order to positively influence peers and other stakeholders

 

Professional growth

 

At Deloitte, our professional development plan focuses on helping people at every level of their career to identify and use their strengths to do their best work every day. From entry-level employees to senior leaders, we believe there’s always room to learn. From on-the-job learning experiences to formal development programs at Deloitte University, our professionals have a variety of opportunities to continue to grow throughout their career. Explore Deloitte University, The Leadership Center.","Oct 29, 2024",3
